sic_code,sic_description,section,section_description,sic_version
42120,Construction of railways and underground railways,F,Construction,SIC 2007
42130,Construction of bridges and tunnels,F,Construction,SIC 2007
42210,Construction of utility projects for fluids,F,Construction,SIC 2007
42220,Construction of utility projects for electricity and telecommunications,F,Construction,SIC 2007
42910,Construction of water projects,F,Construction,SIC 2007
42990,Construction of other civil engineering projects n.e.c.,F,Construction,SIC 2007
43110,Demolition,F,Construction,SIC 2007
43120,Site preparation,F,Construction,SIC 2007
43130,Test drilling and boring,F,Construction,SIC 2007
43210,Electrical installation,F,Construction,SIC 2007
43220,"Plumbing, heat and air-conditioning installation",F,Construction,SIC 2007
43290,Other construction installation,F,Construction,SIC 2007
43310,Plastering,F,Construction,SIC 2007
43320,Joinery installation,F,Construction,SIC 2007
43330,Floor and wall covering,F,Construction,SIC 2007
43341,Painting,F,Construction,SIC 2007
43342,Glazing,F,Construction,SIC 2007
43390,Other building completion and finishing,F,Construction,SIC 2007
43910,Roofing activities,F,Construction,SIC 2007
43991,Scaffold erection,F,Construction,SIC 2007
43999,Other specialised construction activities n.e.c. motorcycles,F,Construction,SIC 2007
45111,Sale of new cars and light motor vehicles,G,Wholesale and retail trade; repair of motor vehicles and,SIC 2007
45112,Sale of used cars and light motor vehicles,G,Wholesale and retail trade; repair of motor vehicles and,SIC 2007
45190,Sale of other motor vehicles,G,Wholesale and retail trade; repair of motor vehicles and,SIC 2007
45200,Maintenance and repair of motor vehicles,G,Wholesale and retail trade; repair of motor vehicles and,SIC 2007
45310,Wholesale trade of motor vehicle parts and accessories,G,Wholesale and retail trade; repair of motor vehicles and,SIC 2007
45320,Retail trade of motor vehicle parts and accessories,G,Wholesale and retail trade; repair of motor vehicles and,SIC 2007
45400,"Sale, maintenance and repair of motorcycles and related parts and accessories",G,Wholesale and retail trade; repair of motor vehicles and,SIC 2007
46110,"Agents selling agricultural raw materials, livestock, textile raw materials and semi-finished goods",G,Wholesale and retail trade; repair of motor vehicles and,SIC 2007
46120,"Agents involved in the sale of fuels, ores, metals and industrial chemicals",G,Wholesale and retail trade; repair of motor vehicles and,SIC 2007
46130,Agents involved in the sale of timber and building materials,G,Wholesale and retail trade; repair of motor vehicles and,SIC 2007
46140,"Agents involved in the sale of machinery, industrial equipment, ships and aircraft",G,Wholesale and retail trade; repair of motor vehicles and,SIC 2007
46150,"Agents involved in the sale of furniture, household goods, hardware and ironmongery",G,Wholesale and retail trade; repair of motor vehicles and,SIC 2007
46160,"Agents involved in the sale of textiles, clothing, fur, footwear and leather goods",G,Wholesale and retail trade; repair of motor vehicles and,SIC 2007
46170,"Agents involved in the sale of food, beverages and tobacco",G,Wholesale and retail trade; repair of motor vehicles and,SIC 2007
46180,Agents specialised in the sale of other particular products,G,Wholesale and retail trade; repair of motor vehicles and,SIC 2007
46190,Agents involved in the sale of a variety of goods,G,Wholesale and retail trade; repair of motor vehicles and,SIC 2007
46210,"Wholesale of grain, unmanufactured tobacco, seeds and animal feeds",G,Wholesale and retail trade; repair of motor vehicles and,SIC 2007
46220,Wholesale of flowers and plants,G,Wholesale and retail trade; repair of motor vehicles and,SIC 2007
46230,Wholesale of live animals,G,Wholesale and retail trade; repair of motor vehicles and,SIC 2007
46240,"Wholesale of hides, skins and leather",G,Wholesale and retail trade; repair of motor vehicles and,SIC 2007
46310,Wholesale of fruit and vegetables,G,Wholesale and retail trade; repair of motor vehicles and,SIC 2007
46320,Wholesale of meat and meat products,G,Wholesale and retail trade; repair of motor vehicles and,SIC 2007
46330,"Wholesale of dairy products, eggs and edible oils and fats",G,Wholesale and retail trade; repair of motor vehicles and,SIC 2007
46341,"Wholesale of fruit and vegetable juices, mineral water and soft drinks",G,Wholesale and retail trade; repair of motor vehicles and,SIC 2007
46342,"Wholesale of wine, beer, spirits and other alcoholic beverages",G,Wholesale and retail trade; repair of motor vehicles and,SIC 2007
46350,Wholesale of tobacco products,G,Wholesale and retail trade; repair of motor vehicles and,SIC 2007
46360,Wholesale of sugar and chocolate and sugar confectionery,G,Wholesale and retail trade; repair of motor vehicles and,SIC 2007
46370,"Wholesale of coffee, tea, cocoa and spices",G,Wholesale and retail trade; repair of motor vehicles and,SIC 2007
46380,"Wholesale of other food, including fish, crustaceans and molluscs",G,Wholesale and retail trade; repair of motor vehicles and,SIC 2007
46390,"Non-specialised wholesale of food, beverages and tobacco",G,Wholesale and retail trade; repair of motor vehicles and,SIC 2007
46410,Wholesale of textiles,G,Wholesale and retail trade; repair of motor vehicles and,SIC 2007
46420,Wholesale of clothing and footwear,G,Wholesale and retail trade; repair of motor vehicles and,SIC 2007
46431,"Wholesale of audio tapes, records, CDs and video tapes and the equipment on which these are played",G,Wholesale and retail trade; repair of motor vehicles and,SIC 2007
46439,"Wholesale of radio, television goods & electrical household appliances (other than records, tapes, CD's & video tapes and the equipment used for playing them)",G,Wholesale and retail trade; repair of motor vehicles and,SIC 2007
46440,Wholesale of china and glassware and cleaning materials,G,Wholesale and retail trade; repair of motor vehicles and,SIC 2007
46450,Wholesale of perfume and cosmetics,G,Wholesale and retail trade; repair of motor vehicles and,SIC 2007
46460,Wholesale of pharmaceutical goods,G,Wholesale and retail trade; repair of motor vehicles and,SIC 2007
46470,"Wholesale of furniture, carpets and lighting equipment",G,Wholesale and retail trade; repair of motor vehicles and,SIC 2007
46480,Wholesale of watches and jewellery,G,Wholesale and retail trade; repair of motor vehicles and,SIC 2007
46491,Wholesale of musical instruments,G,Wholesale and retail trade; repair of motor vehicles and,SIC 2007
46499,Wholesale of household goods (other than musical instruments) n.e.c,G,Wholesale and retail trade; repair of motor vehicles and,SIC 2007
46510,"Wholesale of computers, computer peripheral equipment and software",G,Wholesale and retail trade; repair of motor vehicles and,SIC 2007
46520,Wholesale of electronic and telecommunications equipment and parts,G,Wholesale and retail trade; repair of motor vehicles and,SIC 2007
46610,"Wholesale of agricultural machinery, equipment and supplies",G,Wholesale and retail trade; repair of motor vehicles and,SIC 2007
46620,Wholesale of machine tools,G,Wholesale and retail trade; repair of motor vehicles and,SIC 2007
46630,"Wholesale of mining, construction and civil engineering machinery",G,Wholesale and retail trade; repair of motor vehicles and,SIC 2007
46640,Wholesale of machinery for the textile industry and of sewing and knitting machines,G,Wholesale and retail trade; repair of motor vehicles and,SIC 2007
46650,Wholesale of office furniture,G,Wholesale and retail trade; repair of motor vehicles and,SIC 2007
46660,Wholesale of other office machinery and equipment,G,Wholesale and retail trade; repair of motor vehicles and,SIC 2007
46690,Wholesale of other machinery and equipment,G,Wholesale and retail trade; repair of motor vehicles and,SIC 2007
46711,Wholesale of petroleum and petroleum products,G,Wholesale and retail trade; repair of motor vehicles and,SIC 2007
46719,Wholesale of other fuels and related products,G,Wholesale and retail trade; repair of motor vehicles and,SIC 2007
46720,Wholesale of metals and metal ores,G,Wholesale and retail trade; repair of motor vehicles and,SIC 2007
46730,"Wholesale of wood, construction materials and sanitary equipment",G,Wholesale and retail trade; repair of motor vehicles and,SIC 2007
46740,"Wholesale of hardware, plumbing and heating equipment and supplies",G,Wholesale and retail trade; repair of motor vehicles and,SIC 2007
46750,Wholesale of chemical products,G,Wholesale and retail trade; repair of motor vehicles and,SIC 2007
46760,Wholesale of other intermediate products,G,Wholesale and retail trade; repair of motor vehicles and,SIC 2007
46770,Wholesale of waste and scrap,G,Wholesale and retail trade; repair of motor vehicles and,SIC 2007
46900,Non-specialised wholesale trade,G,Wholesale and retail trade; repair of motor vehicles and,SIC 2007
47110,"Retail sale in non-specialised stores with food, beverages or tobacco predominating",G,Wholesale and retail trade; repair of motor vehicles and,SIC 2007
47190,Other retail sale in non-specialised stores,G,Wholesale and retail trade; repair of motor vehicles and,SIC 2007
47210,Retail sale of fruit and vegetables in specialised stores,G,Wholesale and retail trade; repair of motor vehicles and,SIC 2007
47220,Retail sale of meat and meat products in specialised stores,G,Wholesale and retail trade; repair of motor vehicles and,SIC 2007
47230,"Retail sale of fish, crustaceans and molluscs in specialised stores",G,Wholesale and retail trade; repair of motor vehicles and,SIC 2007
47240,"Retail sale of bread, cakes, flour confectionery and sugar confectionery in specialised stores",G,Wholesale and retail trade; repair of motor vehicles and,SIC 2007
47250,Retail sale of beverages in specialised stores,G,Wholesale and retail trade; repair of motor vehicles and,SIC 2007
47260,Retail sale of tobacco products in specialised stores,G,Wholesale and retail trade; repair of motor vehicles and,SIC 2007
47290,Other retail sale of food in specialised stores,G,Wholesale and retail trade; repair of motor vehicles and,SIC 2007
47300,Retail sale of automotive fuel in specialised stores,G,Wholesale and retail trade; repair of motor vehicles and,SIC 2007
47410,"Retail sale of computers, peripheral units and software in specialised stores",G,Wholesale and retail trade; repair of motor vehicles and,SIC 2007
47421,Retail sale of mobile telephones,G,Wholesale and retail trade; repair of motor vehicles and,SIC 2007
47429,Retail sale of telecommunications equipment other than mobile telephones,G,Wholesale and retail trade; repair of motor vehicles and,SIC 2007
47430,Retail sale of audio and video equipment in specialised stores,G,Wholesale and retail trade; repair of motor vehicles and,SIC 2007
47510,Retail sale of textiles in specialised stores,G,Wholesale and retail trade; repair of motor vehicles and,SIC 2007
47520,"Retail sale of hardware, paints and glass in specialised stores",G,Wholesale and retail trade; repair of motor vehicles and,SIC 2007
47530,"Retail sale of carpets, rugs, wall and floor coverings in specialised stores",G,Wholesale and retail trade; repair of motor vehicles and,SIC 2007
47540,Retail sale of electrical household appliances in specialised stores,G,Wholesale and retail trade; repair of motor vehicles and,SIC 2007
47591,Retail sale of musical instruments and scores,G,Wholesale and retail trade; repair of motor vehicles and,SIC 2007
47599,"Retail of furniture, lighting, and similar (not musical instruments or scores) in specialised store",G,Wholesale and retail trade; repair of motor vehicles and,SIC 2007
47610,Retail sale of books in specialised stores,G,Wholesale and retail trade; repair of motor vehicles and,SIC 2007
47620,Retail sale of newspapers and stationery in specialised stores,G,Wholesale and retail trade; repair of motor vehicles and,SIC 2007
47630,Retail sale of music and video recordings in specialised stores,G,Wholesale and retail trade; repair of motor vehicles and,SIC 2007
47640,"Retail sale of sports goods, fishing gear, camping goods, boats and bicycles",G,Wholesale and retail trade; repair of motor vehicles and,SIC 2007
47650,Retail sale of games and toys in specialised stores,G,Wholesale and retail trade; repair of motor vehicles and,SIC 2007
47710,Retail sale of clothing in specialised stores,G,Wholesale and retail trade; repair of motor vehicles and,SIC 2007
47721,Retail sale of footwear in specialised stores,G,Wholesale and retail trade; repair of motor vehicles and,SIC 2007
47722,Retail sale of leather goods in specialised stores,G,Wholesale and retail trade; repair of motor vehicles and,SIC 2007
47730,Dispensing chemist in specialised stores,G,Wholesale and retail trade; repair of motor vehicles and,SIC 2007
47741,Retail sale of hearing aids,G,Wholesale and retail trade; repair of motor vehicles and,SIC 2007
47749,Retail sale of medical and orthopaedic goods in specialised stores (not incl. hearing aids) n.e.c.,G,Wholesale and retail trade; repair of motor vehicles and,SIC 2007
47750,Retail sale of cosmetic and toilet articles in specialised stores,G,Wholesale and retail trade; repair of motor vehicles and,SIC 2007
47760,"Retail sale of flowers, plants, seeds, fertilizers, pet animals and pet food in specialised stores",G,Wholesale and retail trade; repair of motor vehicles and,SIC 2007
47770,Retail sale of watches and jewellery in specialised stores,G,Wholesale and retail trade; repair of motor vehicles and,SIC 2007
47781,Retail sale in commercial art galleries,G,Wholesale and retail trade; repair of motor vehicles and,SIC 2007
47782,Retail sale by opticians,G,Wholesale and retail trade; repair of motor vehicles and,SIC 2007
47789,Other retail sale of new goods in specialised stores (not commercial art galleries and opticians),G,Wholesale and retail trade; repair of motor vehicles and,SIC 2007
47791,Retail sale of antiques including antique books in stores,G,Wholesale and retail trade; repair of motor vehicles and,SIC 2007
47799,Retail sale of other second-hand goods in stores (not incl. antiques),G,Wholesale and retail trade; repair of motor vehicles and,SIC 2007
47810,"Retail sale via stalls and markets of food, beverages and tobacco products",G,Wholesale and retail trade; repair of motor vehicles and,SIC 2007
47820,"Retail sale via stalls and markets of textiles, clothing and footwear",G,Wholesale and retail trade; repair of motor vehicles and,SIC 2007
47890,Retail sale via stalls and markets of other goods,G,Wholesale and retail trade; repair of motor vehicles and,SIC 2007
47910,Retail sale via mail order houses or via Internet,G,Wholesale and retail trade; repair of motor vehicles and,SIC 2007
47990,"Other retail sale not in stores, stalls or markets",G,Wholesale and retail trade; repair of motor vehicles and,SIC 2007
49100,"Passenger rail transport, interurban",H,Transportation and storage,SIC 2007
49200,Freight rail transport,H,Transportation and storage,SIC 2007
49311,"Urban and suburban passenger railway transportation by underground, metro and similar systems",H,Transportation and storage,SIC 2007
49319,"Other urban, suburban or metropolitan passenger land transport (not underground, metro or similar)",H,Transportation and storage,SIC 2007
49320,Taxi operation,H,Transportation and storage,SIC 2007
49390,Other passenger land transport,H,Transportation and storage,SIC 2007
49410,Freight transport by road,H,Transportation and storage,SIC 2007
49420,Removal services,H,Transportation and storage,SIC 2007
49500,Transport via pipeline,H,Transportation and storage,SIC 2007
50100,Sea and coastal passenger water transport,H,Transportation and storage,SIC 2007
50200,Sea and coastal freight water transport,H,Transportation and storage,SIC 2007
50300,Inland passenger water transport,H,Transportation and storage,SIC 2007
50400,Inland freight water transport,H,Transportation and storage,SIC 2007
51101,Scheduled passenger air transport,H,Transportation and storage,SIC 2007
51102,Non-scheduled passenger air transport,H,Transportation and storage,SIC 2007
51210,Freight air transport,H,Transportation and storage,SIC 2007
51220,Space transport,H,Transportation and storage,SIC 2007
52101,Operation of warehousing and storage facilities for water transport activities,H,Transportation and storage,SIC 2007
52102,Operation of warehousing and storage facilities for air transport activities,H,Transportation and storage,SIC 2007
52103,Operation of warehousing and storage facilities for land transport activities,H,Transportation and storage,SIC 2007
52211,Operation of rail freight terminals,H,Transportation and storage,SIC 2007
52212,Operation of rail passenger facilities at railway stations,H,Transportation and storage,SIC 2007
52213,Operation of bus and coach passenger facilities at bus and coach stations,H,Transportation and storage,SIC 2007
52219,"Other service activities incidental to land transportation, n.e.c.",H,Transportation and storage,SIC 2007
52220,Service activities incidental to water transportation,H,Transportation and storage,SIC 2007
52230,Service activities incidental to air transportation,H,Transportation and storage,SIC 2007
52241,Cargo handling for water transport activities,H,Transportation and storage,SIC 2007
52242,Cargo handling for air transport activities,H,Transportation and storage,SIC 2007
52243,Cargo handling for land transport activities,H,Transportation and storage,SIC 2007
52290,Other transportation support activities,H,Transportation and storage,SIC 2007
53100,Postal activities under universal service obligation,H,Transportation and storage,SIC 2007
53201,Licensed carriers,H,Transportation and storage,SIC 2007
53202,Unlicensed carriers,H,Transportation and storage,SIC 2007
55100,Hotels and similar accommodation,I,Accommodation and food service activities,SIC 2007
55201,Holiday centres and villages,I,Accommodation and food service activities,SIC 2007
55202,Youth hostels,I,Accommodation and food service activities,SIC 2007
55209,Other holiday and other collective accommodation,I,Accommodation and food service activities,SIC 2007
55300,"Recreational vehicle parks, trailer parks and camping grounds",I,Accommodation and food service activities,SIC 2007
55900,Other accommodation,I,Accommodation and food service activities,SIC 2007
56101,Licenced restaurants,I,Accommodation and food service activities,SIC 2007
56102,Unlicenced restaurants and cafes,I,Accommodation and food service activities,SIC 2007
56103,Take-away food shops and mobile food stands,I,Accommodation and food service activities,SIC 2007
56210,Event catering activities,I,Accommodation and food service activities,SIC 2007
56290,Other food services,I,Accommodation and food service activities,SIC 2007
56301,Licenced clubs,I,Accommodation and food service activities,SIC 2007
56302,Public houses and bars,I,Accommodation and food service activities,SIC 2007
58110,Book publishing,J,Information and communication,SIC 2007
58120,Publishing of directories and mailing lists,J,Information and communication,SIC 2007
58130,Publishing of newspapers,J,Information and communication,SIC 2007
58141,Publishing of learned journals,J,Information and communication,SIC 2007
58142,Publishing of consumer and business journals and periodicals,J,Information and communication,SIC 2007
58190,Other publishing activities,J,Information and communication,SIC 2007
58210,Publishing of computer games,J,Information and communication,SIC 2007
58290,Other software publishing,J,Information and communication,SIC 2007
59111,Motion picture production activities,J,Information and communication,SIC 2007
59112,Video production activities,J,Information and communication,SIC 2007
59113,Television programme production activities,J,Information and communication,SIC 2007
59120,"Motion picture, video and television programme post- production activities",J,Information and communication,SIC 2007
59131,Motion picture distribution activities,J,Information and communication,SIC 2007
59132,Video distribution activities,J,Information and communication,SIC 2007
59133,Television programme distribution activities,J,Information and communication,SIC 2007
59140,Motion picture projection activities,J,Information and communication,SIC 2007
59200,Sound recording and music publishing activities,J,Information and communication,SIC 2007
60100,Radio broadcasting,J,Information and communication,SIC 2007
60200,Television programming and broadcasting activities,J,Information and communication,SIC 2007
61100,Wired telecommunications activities,J,Information and communication,SIC 2007
61200,Wireless telecommunications activities,J,Information and communication,SIC 2007
61300,Satellite telecommunications activities,J,Information and communication,SIC 2007
61900,Other telecommunications activities,J,Information and communication,SIC 2007
62011,Ready-made interactive leisure and entertainment software development,J,Information and communication,SIC 2007
62012,Business and domestic software development,J,Information and communication,SIC 2007
62020,Information technology consultancy activities,J,Information and communication,SIC 2007
62030,Computer facilities management activities,J,Information and communication,SIC 2007
62090,Other information technology service activities,J,Information and communication,SIC 2007
63110,"Data processing, hosting and related activities",J,Information and communication,SIC 2007
63120,Web portals,J,Information and communication,SIC 2007
63910,News agency activities,J,Information and communication,SIC 2007
63990,Other information service activities n.e.c.,J,Information and communication,SIC 2007
64110,Central banking,K,Financial and insurance activities,SIC 2007
64191,Banks,K,Financial and insurance activities,SIC 2007
64192,Building societies,K,Financial and insurance activities,SIC 2007
64201,Activities of agricultural holding companies,K,Financial and insurance activities,SIC 2007
64202,Activities of production holding companies,K,Financial and insurance activities,SIC 2007
64203,Activities of construction holding companies,K,Financial and insurance activities,SIC 2007
64204,Activities of distribution holding companies,K,Financial and insurance activities,SIC 2007
64205,Activities of financial services holding companies,K,Financial and insurance activities,SIC 2007
64209,Activities of other holding companies n.e.c.,K,Financial and insurance activities,SIC 2007
64301,Activities of investment trusts,K,Financial and insurance activities,SIC 2007
64302,Activities of unit trusts,K,Financial and insurance activities,SIC 2007
64303,Activities of venture and development capital companies,K,Financial and insurance activities,SIC 2007
64304,Activities of open-ended investment companies,K,Financial and insurance activities,SIC 2007
64305,Activities of property unit trusts,K,Financial and insurance activities,SIC 2007
64306,Activities of real estate investment trusts,K,Financial and insurance activities,SIC 2007
64910,Financial leasing,K,Financial and insurance activities,SIC 2007
64921,Credit granting by non-deposit taking finance houses and other specialist consumer credit grantors,K,Financial and insurance activities,SIC 2007
64922,Activities of mortgage finance companies,K,Financial and insurance activities,SIC 2007
64929,Other credit granting n.e.c.,K,Financial and insurance activities,SIC 2007
64991,Security dealing on own account,K,Financial and insurance activities,SIC 2007
64992,Factoring,K,Financial and insurance activities,SIC 2007
64999,Financial intermediation not elsewhere classified,K,Financial and insurance activities,SIC 2007
65110,Life insurance,K,Financial and insurance activities,SIC 2007
65120,Non-life insurance,K,Financial and insurance activities,SIC 2007
65201,Life reinsurance,K,Financial and insurance activities,SIC 2007
65202,Non-life reinsurance,K,Financial and insurance activities,SIC 2007
65300,Pension funding,K,Financial and insurance activities,SIC 2007
66110,Administration of financial markets,K,Financial and insurance activities,SIC 2007
66120,Security and commodity contracts dealing activities,K,Financial and insurance activities,SIC 2007
66190,Activities auxiliary to financial intermediation n.e.c.,K,Financial and insurance activities,SIC 2007
66210,Risk and damage evaluation,K,Financial and insurance activities,SIC 2007
66220,Activities of insurance agents and brokers,K,Financial and insurance activities,SIC 2007
66290,Other activities auxiliary to insurance and pension funding,K,Financial and insurance activities,SIC 2007
66300,Fund management activities,K,Financial and insurance activities,SIC 2007
68100,Buying and selling of own real estate,L,Real estate activities,SIC 2007
68201,Renting and operating of Housing Association real estate,L,Real estate activities,SIC 2007
68202,Letting and operating of conference and exhibition centres,L,Real estate activities,SIC 2007
68209,Other letting and operating of own or leased real estate,L,Real estate activities,SIC 2007
68310,Real estate agencies,L,Real estate activities,SIC 2007
68320,Management of real estate on a fee or contract basis,L,Real estate activities,SIC 2007
69101,Barristers at law,M,"Professional, scientific and technical activities",SIC 2007
69102,Solicitors,M,"Professional, scientific and technical activities",SIC 2007
69109,Activities of patent and copyright agents; other legal activities n.e.c.,M,"Professional, scientific and technical activities",SIC 2007
69201,Accounting and auditing activities,M,"Professional, scientific and technical activities",SIC 2007
69202,Bookkeeping activities,M,"Professional, scientific and technical activities",SIC 2007
69203,Tax consultancy,M,"Professional, scientific and technical activities",SIC 2007
70100,Activities of head offices,M,"Professional, scientific and technical activities",SIC 2007
