sic_code,sic_description,section,section_description,sic_version
70210,Public relations and communications activities,M,"Professional, scientific and technical activities",SIC 2007
70221,Financial management,M,"Professional, scientific and technical activities",SIC 2007
70229,Management consultancy activities other than financial management,M,"Professional, scientific and technical activities",SIC 2007
71111,Architectural activities,M,"Professional, scientific and technical activities",SIC 2007
71112,Urban planning and landscape architectural activities,M,"Professional, scientific and technical activities",SIC 2007
71121,Engineering design activities for industrial process and production,M,"Professional, scientific and technical activities",SIC 2007
71122,Engineering related scientific and technical consulting activities,M,"Professional, scientific and technical activities",SIC 2007
71129,Other engineering activities,M,"Professional, scientific and technical activities",SIC 2007
71200,Technical testing and analysis,M,"Professional, scientific and technical activities",SIC 2007
72110,Research and experimental development on biotechnology,M,"Professional, scientific and technical activities",SIC 2007
72190,Other research and experimental development on natural sciences and engineering,M,"Professional, scientific and technical activities",SIC 2007
72200,Research and experimental development on social sciences and humanities,M,"Professional, scientific and technical activities",SIC 2007
73110,Advertising agencies,M,"Professional, scientific and technical activities",SIC 2007
73120,Media representation services,M,"Professional, scientific and technical activities",SIC 2007
73200,Market research and public opinion polling,M,"Professional, scientific and technical activities",SIC 2007
74100,specialised design activities,M,"Professional, scientific and technical activities",SIC 2007
74201,Portrait photographic activities,M,"Professional, scientific and technical activities",SIC 2007
74202,Other specialist photography,M,"Professional, scientific and technical activities",SIC 2007
74203,Film processing,M,"Professional, scientific and technical activities",SIC 2007
74209,Photographic activities not elsewhere classified,M,"Professional, scientific and technical activities",SIC 2007
74300,Translation and interpretation activities,M,"Professional, scientific and technical activities",SIC 2007
74901,Environmental consulting activities,M,"Professional, scientific and technical activities",SIC 2007
74902,Quantity surveying activities,M,"Professional, scientific and technical activities",SIC 2007
74909,"Other professional, scientific and technical activities n.e.c.",M,"Professional, scientific and technical activities",SIC 2007
74990,Non-trading company non trading,M,"Professional, scientific and technical activities",SIC 2007
75000,Veterinary activities,M,"Professional, scientific and technical activities",SIC 2007
77110,Renting and leasing of cars and light motor vehicles,N,Administrative and support service activities,SIC 2007
77120,Renting and leasing of trucks and other heavy vehicles,N,Administrative and support service activities,SIC 2007
77210,Renting and leasing of recreational and sports goods,N,Administrative and support service activities,SIC 2007
77220,Renting of video tapes and disks,N,Administrative and support service activities,SIC 2007
77291,Renting and leasing of media entertainment equipment,N,Administrative and support service activities,SIC 2007
77299,Renting and leasing of other personal and household goods,N,Administrative and support service activities,SIC 2007
77310,Renting and leasing of agricultural machinery and equipment,N,Administrative and support service activities,SIC 2007
77320,Renting and leasing of construction and civil engineering machinery and equipment,N,Administrative and support service activities,SIC 2007
77330,Renting and leasing of office machinery and equipment (including computers),N,Administrative and support service activities,SIC 2007
77341,Renting and leasing of passenger water transport equipment,N,Administrative and support service activities,SIC 2007
77342,Renting and leasing of freight water transport equipment,N,Administrative and support service activities,SIC 2007
77351,Renting and leasing of air passenger transport equipment,N,Administrative and support service activities,SIC 2007
77352,Renting and leasing of freight air transport equipment,N,Administrative and support service activities,SIC 2007
77390,"Renting and leasing of other machinery, equipment and tangible goods n.e.c.",N,Administrative and support service activities,SIC 2007
77400,"Leasing of intellectual property and similar products, except copyright works",N,Administrative and support service activities,SIC 2007
78101,"Motion picture, television and other theatrical casting activities",N,Administrative and support service activities,SIC 2007
78109,Other activities of employment placement agencies,N,Administrative and support service activities,SIC 2007
78200,Temporary employment agency activities,N,Administrative and support service activities,SIC 2007
78300,Human resources provision and management of human resources functions,N,Administrative and support service activities,SIC 2007
79110,Travel agency activities,N,Administrative and support service activities,SIC 2007
79120,Tour operator activities,N,Administrative and support service activities,SIC 2007
79901,Activities of tourist guides,N,Administrative and support service activities,SIC 2007
79909,Other reservation service activities n.e.c.,N,Administrative and support service activities,SIC 2007
80100,Private security activities,N,Administrative and support service activities,SIC 2007
80200,Security systems service activities,N,Administrative and support service activities,SIC 2007
80300,Investigation activities,N,Administrative and support service activities,SIC 2007
81100,Combined facilities support activities,N,Administrative and support service activities,SIC 2007
81210,General cleaning of buildings,N,Administrative and support service activities,SIC 2007
81221,Window cleaning services,N,Administrative and support service activities,SIC 2007
81222,Specialised cleaning services,N,Administrative and support service activities,SIC 2007
81223,Furnace and chimney cleaning services,N,Administrative and support service activities,SIC 2007
81229,Other building and industrial cleaning activities,N,Administrative and support service activities,SIC 2007
81291,Disinfecting and exterminating services,N,Administrative and support service activities,SIC 2007
81299,Other cleaning services,N,Administrative and support service activities,SIC 2007
81300,Landscape service activities,N,Administrative and support service activities,SIC 2007
82110,Combined office administrative service activities,N,Administrative and support service activities,SIC 2007
82190,"Photocopying, document preparation and other specialised office support activities",N,Administrative and support service activities,SIC 2007
82200,Activities of call centres,N,Administrative and support service activities,SIC 2007
82301,Activities of exhibition and fair organisers,N,Administrative and support service activities,SIC 2007
82302,Activities of conference organisers,N,Administrative and support service activities,SIC 2007
82911,Activities of collection agencies,N,Administrative and support service activities,SIC 2007
82912,Activities of credit bureaus,N,Administrative and support service activities,SIC 2007
82920,Packaging activities,N,Administrative and support service activities,SIC 2007
82990,Other business support service activities n.e.c. security,N,Administrative and support service activities,SIC 2007
84110,General public administration activities,O,Public administration and defence; compulsory social,SIC 2007
84120,"Regulation of health care, education, cultural and other social services, not incl. social security",O,Public administration and defence; compulsory social,SIC 2007
84130,Regulation of and contribution to more efficient operation of businesses,O,Public administration and defence; compulsory social,SIC 2007
84210,Foreign affairs,O,Public administration and defence; compulsory social,SIC 2007
84220,Defence activities,O,Public administration and defence; compulsory social,SIC 2007
84230,Justice and judicial activities,O,Public administration and defence; compulsory social,SIC 2007
84240,Public order and safety activities,O,Public administration and defence; compulsory social,SIC 2007
84250,Fire service activities,O,Public administration and defence; compulsory social,SIC 2007
84300,Compulsory social security activities,O,Public administration and defence; compulsory social,SIC 2007
85100,Pre-primary education,P,Education,SIC 2007
85200,Primary education,P,Education,SIC 2007
85310,General secondary education,P,Education,SIC 2007
85320,Technical and vocational secondary education,P,Education,SIC 2007
85410,Post-secondary non-tertiary education,P,Education,SIC 2007
85421,First-degree level higher education,P,Education,SIC 2007
85422,Post-graduate level higher education,P,Education,SIC 2007
85510,Sports and recreation education,P,Education,SIC 2007
85520,Cultural education,P,Education,SIC 2007
85530,Driving school activities,P,Education,SIC 2007
85590,Other education n.e.c.,P,Education,SIC 2007
85600,Educational support services,P,Education,SIC 2007
86101,Hospital activities,Q,Human health and social work activities,SIC 2007
86102,Medical nursing home activities,Q,Human health and social work activities,SIC 2007
86210,General medical practice activities,Q,Human health and social work activities,SIC 2007
86220,Specialists medical practice activities,Q,Human health and social work activities,SIC 2007
86230,Dental practice activities,Q,Human health and social work activities,SIC 2007
86900,Other human health activities,Q,Human health and social work activities,SIC 2007
87100,Residential nursing care facilities,Q,Human health and social work activities,SIC 2007
87200,"Residential care activities for learning difficulties, mental health and substance abuse",Q,Human health and social work activities,SIC 2007
87300,Residential care activities for the elderly and disabled,Q,Human health and social work activities,SIC 2007
87900,Other residential care activities n.e.c.,Q,Human health and social work activities,SIC 2007
88100,Social work activities without accommodation for the elderly and disabled,Q,Human health and social work activities,SIC 2007
88910,Child day-care activities,Q,Human health and social work activities,SIC 2007
88990,Other social work activities without accommodation n.e.c.,Q,Human health and social work activities,SIC 2007
90010,Performing arts,R,"Arts, entertainment and recreation",SIC 2007
90020,Support activities to performing arts,R,"Arts, entertainment and recreation",SIC 2007
90030,Artistic creation,R,"Arts, entertainment and recreation",SIC 2007
90040,Operation of arts facilities,R,"Arts, entertainment and recreation",SIC 2007
91011,Library activities,R,"Arts, entertainment and recreation",SIC 2007
91012,Archives activities,R,"Arts, entertainment and recreation",SIC 2007
91020,Museums activities,R,"Arts, entertainment and recreation",SIC 2007
91030,Operation of historical sites and buildings and similar visitor attractions,R,"Arts, entertainment and recreation",SIC 2007
91040,Botanical and zoological gardens and nature reserves activities,R,"Arts, entertainment and recreation",SIC 2007
92000,Gambling and betting activities,R,"Arts, entertainment and recreation",SIC 2007
93110,Operation of sports facilities,R,"Arts, entertainment and recreation",SIC 2007
93120,Activities of sport clubs,R,"Arts, entertainment and recreation",SIC 2007
93130,Fitness facilities,R,"Arts, entertainment and recreation",SIC 2007
93191,Activities of racehorse owners,R,"Arts, entertainment and recreation",SIC 2007
93199,Other sports activities,R,"Arts, entertainment and recreation",SIC 2007
93210,Activities of amusement parks and theme parks,R,"Arts, entertainment and recreation",SIC 2007
93290,Other amusement and recreation activities n.e.c.,R,"Arts, entertainment and recreation",SIC 2007
94110,Activities of business and employers membership organisations,S,Other service activities,SIC 2007
94120,Activities of professional membership organisations,S,Other service activities,SIC 2007
94200,Activities of trade unions,S,Other service activities,SIC 2007
94910,Activities of religious organisations,S,Other service activities,SIC 2007
94920,Activities of political organisations,S,Other service activities,SIC 2007
94990,Activities of other membership organisations n.e.c.,S,Other service activities,SIC 2007
95110,Repair of computers and peripheral equipment,S,Other service activities,SIC 2007
95120,Repair of communication equipment,S,Other service activities,SIC 2007
95210,Repair of consumer electronics,S,Other service activities,SIC 2007
95220,Repair of household appliances and home and garden equipment,S,Other service activities,SIC 2007
95230,Repair of footwear and leather goods,S,Other service activities,SIC 2007
95240,Repair of furniture and home furnishings,S,Other service activities,SIC 2007
95250,"Repair of watches, clocks and jewellery",S,Other service activities,SIC 2007
95290,Repair of personal and household goods n.e.c.,S,Other service activities,SIC 2007
96010,Washing and (dry-)cleaning of textile and fur products,S,Other service activities,SIC 2007
96020,Hairdressing and other beauty treatment,S,Other service activities,SIC 2007
96030,Funeral and related activities,S,Other service activities,SIC 2007
96040,Physical well-being activities,S,Other service activities,SIC 2007
96090,Other service activities n.e.c. goods- and services-producing activities of households for own use,S,Other service activities,SIC 2007
97000,Activities of households as employers of domestic personnel,T,Activities of households as employers; undifferentiated,SIC 2007
98000,Residents property management,T,Activities of households as employers; undifferentiated,SIC 2007
98100,Undifferentiated goods-producing activities of private households for own use,T,Activities of households as employers; undifferentiated,SIC 2007
98200,Undifferentiated service-producing activities of private households for own use bodies,T,Activities of households as employers; undifferentiated,SIC 2007
99000,Activities of extraterritorial organisations and bodies,U,Activities of extraterritorial organisations and,SIC 2007
99999,Dormant Company,U,Activities of extraterritorial organisations and,SIC 2007
